{
  "profileId": "android-generic",
  "language": "en",
  "label": "Generic Android (Pixel, AOSP)",
  "manufacturer": "*",
  "androidVersions": [{ "minSdk": 29, "maxSdk": 35 }],
  "categories": [
    {
      "categoryId": "identite",
      "label": "Identity & advertising",
      "description": "Prevent advertising tracking and profiling by Google and third-party ad networks.",
      "checks": [
        {
          "checkId": "advertising-id",
          "title": "Delete the advertising ID",
          "risk": "A unique identifier used by ad networks to build your profile across all apps.",
          "whyItMatters": "Since Android 12, you can fully delete this ID instead of just resetting it.",
          "severity": "critical",
          "autoDetect": { "kind": "advertising-id", "target": "status" },
          "steps": [
            {
              "label": "Open Google settings",
              "intent": { "action": "android.settings.SETTINGS" },
              "fallbackPath": "Settings > Google > All services > Ads"
            },
            { "label": "Tap \"Delete advertising ID\"" }
          ]
        },
        {
          "checkId": "personalized-ads",
          "title": "Turn off Google personalized ads",
          "risk": "Without this step, Google uses your history to target ads across its services.",
          "severity": "important",
          "steps": [
            {
              "label": "Open adssettings.google.com in your browser",
              "intent": {
                "action": "android.intent.action.VIEW",
                "data": "https://adssettings.google.com"
              }
            },
            { "label": "Turn off \"Personalized ads\"" }
          ]
        }
      ]
    },
    {
      "categoryId": "reseau",
      "label": "Network & sovereign DNS",
      "description": "Encrypt your DNS queries and choose an operator that does not sell your data.",
      "checks": [
        {
          "checkId": "private-dns",
          "title": "Enable a sovereign private DNS",
          "risk": "Without private DNS, your ISP sees every site you visit, even over HTTPS.",
          "whyItMatters": "Private DNS (DoT) encrypts these queries and routes them to an operator you choose.",
          "severity": "critical",
          "autoDetect": { "kind": "private-dns", "target": "mode" },
          "steps": [
            {
              "label": "Open private DNS settings",
              "intent": { "action": "android.settings.WIRELESS_SETTINGS" },
              "fallbackPath": "Settings > Network & internet > Private DNS"
            },
            { "label": "Select \"Private DNS provider hostname\"" },
            { "label": "Enter the recommended hostname for your country" }
          ],
          "dnsOptionsCountryFile": "dns/{country}.json"
        },
        {
          "checkId": "wifi-scanning",
          "title": "Disable always-on Wi-Fi/Bluetooth scanning",
          "risk": "Android continuously scans Wi-Fi and Bluetooth networks to improve location, even when you don't use them.",
          "severity": "important",
          "steps": [
            {
              "label": "Open location settings",
              "intent": { "action": "android.settings.LOCATION_SOURCE_SETTINGS" },
              "fallbackPath": "Settings > Location > Location services"
            },
            { "label": "Turn off \"Wi-Fi scanning\" and \"Bluetooth scanning\"" }
          ]
        }
      ]
    },
    {
      "categoryId": "assistants",
      "label": "Voice assistants & keyboard",
      "description": "Prevent permanent listening and typing-data collection.",
      "checks": [
        {
          "checkId": "google-assistant-hotword",
          "title": "Turn off \"Hey Google\"",
          "risk": "With the hotword enabled, the microphone is always listening.",
          "severity": "important",
          "steps": [
            { "label": "Open the Google app, then Settings > Google Assistant" },
            { "label": "Go to \"Hey Google & Voice Match\" and turn it off" }
          ]
        },
        {
          "checkId": "gboard-stats",
          "title": "Turn off Gboard usage statistics",
          "risk": "Gboard can send typing statistics and snippets to Google to \"improve\" the keyboard.",
          "severity": "recommended",
          "steps": [
            { "label": "Open Gboard > Advanced" },
            { "label": "Turn off \"Share usage statistics\" and \"Share snippets\"" }
          ]
        }
      ]
    },
    {
      "categoryId": "permissions",
      "label": "App permissions",
      "description": "Check that no app has unjustified access to your microphone, camera, or location.",
      "checks": [
        {
          "checkId": "permissions-audit",
          "title": "Audit sensitive permissions",
          "risk": "Some apps keep microphone, camera, or background location access far beyond what they need.",
          "severity": "critical",
          "steps": [
            {
              "label": "Open the permission manager",
              "intent": { "action": "android.settings.PRIVACY_SETTINGS" },
              "fallbackPath": "Settings > Privacy > Permission manager"
            },
            { "label": "Go through each category (Microphone, Camera, Location) and restrict suspicious apps" }
          ]
        }
      ]
    }
  ]
}
