{
  "profileId": "motorola",
  "language": "en",
  "label": "Motorola",
  "manufacturer": "motorola",
  "androidVersions": [{ "minSdk": 29, "maxSdk": 35 }],
  "categories": [
    {
      "categoryId": "identite",
      "label": "Identity & advertising",
      "description": "Prevent advertising tracking and profiling by Google and third-party ad networks.",
      "checks": [
        {
          "checkId": "advertising-id",
          "title": "Delete the advertising ID",
          "risk": "A unique identifier used by ad networks to build your profile across all apps.",
          "whyItMatters": "Since Android 12, you can fully delete this ID instead of just resetting it.",
          "severity": "critical",
          "autoDetect": { "kind": "advertising-id", "target": "status" },
          "steps": [
            {
              "label": "Open Google settings",
              "intent": { "action": "android.settings.SETTINGS" },
              "fallbackPath": "Settings > Google > All services > Ads"
            },
            { "label": "Tap \"Delete advertising ID\"" }
          ]
        },
        {
          "checkId": "personalized-ads",
          "title": "Turn off Google personalized ads",
          "risk": "Without this step, Google uses your history to target ads across its services.",
          "severity": "important",
          "steps": [
            {
              "label": "Open adssettings.google.com in your browser",
              "intent": {
                "action": "android.intent.action.VIEW",
                "data": "https://adssettings.google.com"
              }
            },
            { "label": "Turn off \"Personalized ads\"" }
          ]
        }
      ]
    },
    {
      "categoryId": "reseau",
      "label": "Network & sovereign DNS",
      "description": "Encrypt your DNS queries and choose an operator that does not sell your data.",
      "checks": [
        {
          "checkId": "private-dns",
          "title": "Enable a sovereign private DNS",
          "risk": "Without private DNS, your ISP sees every site you visit, even over HTTPS.",
          "whyItMatters": "Private DNS (DoT) encrypts these queries and routes them to an operator you choose.",
          "severity": "critical",
          "autoDetect": { "kind": "private-dns", "target": "mode" },
          "steps": [
            {
              "label": "Open network settings",
              "intent": { "action": "android.settings.WIRELESS_SETTINGS" },
              "fallbackPath": "Settings > Network & internet > Private DNS"
            },
            { "label": "Select \"Private DNS provider hostname\"" },
            { "label": "Enter the recommended hostname for your country" }
          ],
          "dnsOptionsCountryFile": "dns/{country}.json"
        },
        {
          "checkId": "wifi-scanning",
          "title": "Disable always-on Wi-Fi/Bluetooth scanning",
          "risk": "Android continuously scans Wi-Fi and Bluetooth networks to improve location, even when you don't use them.",
          "severity": "important",
          "steps": [
            {
              "label": "Open location settings",
              "intent": { "action": "android.settings.LOCATION_SOURCE_SETTINGS" },
              "fallbackPath": "Settings > Location > Location services"
            },
            { "label": "Turn off \"Wi-Fi scanning\" and \"Bluetooth scanning\"" }
          ]
        }
      ]
    },
    {
      "categoryId": "assistants",
      "label": "Voice assistants",
      "description": "Prevent permanent microphone listening.",
      "checks": [
        {
          "checkId": "google-assistant-hotword",
          "title": "Turn off \"Hey Google\"",
          "risk": "With the hotword enabled, the microphone is always listening.",
          "severity": "important",
          "steps": [
            { "label": "Open the Google app, then Settings > Google Assistant" },
            { "label": "Go to \"Hey Google & Voice Match\" and turn it off" }
          ]
        }
      ]
    },
    {
      "categoryId": "motorola-services",
      "label": "Motorola services",
      "description": "Limit data collection by Motorola and Lenovo.",
      "checks": [
        {
          "checkId": "motorola-services-checkin",
          "title": "Turn off data sharing with Motorola",
          "risk": "Motorola and its parent company Lenovo collect device usage information through \"Enhanced Device Support\" and \"Help Improve\" options that are on by default.",
          "whyItMatters": "These options regularly send usage reports to Motorola/Lenovo servers, even when you don't use any Motorola apps.",
          "severity": "critical",
          "steps": [
            {
              "label": "Open system settings",
              "intent": { "action": "android.settings.SETTINGS" },
              "fallbackPath": "Settings > System > Enhanced Device Support"
            },
            { "label": "Turn off \"Enhanced Device Support\"" },
            { "label": "Search for \"Help Improve\" in settings and turn off every option you find" }
          ]
        },
        {
          "checkId": "motorola-privacy-preferences",
          "title": "Review Moto Secure preferences",
          "risk": "The Moto Secure app groups several Motorola privacy settings (dashboard, permissions, network) and some of them may share data with Motorola.",
          "severity": "important",
          "steps": [
            {
              "label": "Open Security & privacy",
              "intent": { "action": "android.settings.PRIVACY_SETTINGS" },
              "fallbackPath": "Settings > Security & privacy > More security & privacy"
            },
            { "label": "Go through the Moto Secure sections and turn off any unwanted data sharing" }
          ]
        }
      ]
    },
    {
      "categoryId": "permissions",
      "label": "App permissions",
      "description": "Check that no app has unjustified access to your microphone, camera, or location.",
      "checks": [
        {
          "checkId": "permissions-audit",
          "title": "Audit sensitive permissions",
          "risk": "Some apps keep microphone, camera, or background location access far beyond what they need.",
          "severity": "critical",
          "steps": [
            {
              "label": "Open the permission manager",
              "intent": { "action": "android.settings.PRIVACY_SETTINGS" },
              "fallbackPath": "Settings > Security & privacy > Privacy > Permission manager"
            },
            { "label": "Go through each category (Microphone, Camera, Location) and restrict suspicious apps" }
          ]
        }
      ]
    }
  ]
}
