{
  "profileId": "motorola",
  "language": "es",
  "label": "Motorola (My UX)",
  "manufacturer": "motorola",
  "androidVersions": [{ "minSdk": 29, "maxSdk": 35 }],
  "categories": [
    {
      "categoryId": "identite",
      "label": "Identidad y publicidad",
      "description": "Evitar el rastreo publicitario y la elaboración de perfiles por parte de Google y las redes publicitarias.",
      "checks": [
        {
          "checkId": "advertising-id",
          "title": "Eliminar el identificador de publicidad",
          "risk": "Un identificador único utilizado por las redes publicitarias para crear tu perfil en todas las aplicaciones.",
          "whyItMatters": "Desde Android 12, puedes eliminar completamente este identificador en lugar de solo restablecerlo.",
          "severity": "critical",
          "autoDetect": { "kind": "advertising-id", "target": "status" },
          "steps": [
            {
              "label": "Abrir los ajustes de Google",
              "intent": { "action": "android.settings.SETTINGS" },
              "fallbackPath": "Ajustes > Google > Todos los servicios > Anuncios"
            },
            { "label": "Pulsar « Eliminar ID de publicidad »" }
          ]
        },
        {
          "checkId": "personalized-ads",
          "title": "Desactivar los anuncios personalizados de Google",
          "risk": "Sin este paso, Google utiliza tu historial para segmentar los anuncios en sus servicios.",
          "severity": "important",
          "steps": [
            {
              "label": "Ir a adssettings.google.com desde tu navegador",
              "intent": {
                "action": "android.intent.action.VIEW",
                "data": "https://adssettings.google.com"
              }
            },
            { "label": "Desactivar « Anuncios personalizados »" }
          ]
        }
      ]
    },
    {
      "categoryId": "reseau",
      "label": "Red y DNS soberano",
      "description": "Cifrar tus consultas DNS y elegir un operador que no venda tus datos.",
      "checks": [
        {
          "checkId": "private-dns",
          "title": "Activar un DNS privado soberano",
          "risk": "Sin DNS privado, tu proveedor de acceso ve cada sitio que visitas, incluso a través de HTTPS.",
          "whyItMatters": "El DNS privado (DoT) cifra estas consultas y las envía a un operador que tú eliges.",
          "severity": "critical",
          "autoDetect": { "kind": "private-dns", "target": "mode" },
          "steps": [
            {
              "label": "Abrir los ajustes de red",
              "intent": { "action": "android.settings.WIRELESS_SETTINGS" },
              "fallbackPath": "Ajustes > Red e internet > DNS privado"
            },
            { "label": "Elegir « Nombre de host del proveedor de DNS privado »" },
            { "label": "Introducir el nombre de host recomendado según tu país" }
          ],
          "dnsOptionsCountryFile": "dns/{country}.json"
        },
        {
          "checkId": "wifi-scanning",
          "title": "Desactivar la búsqueda permanente de Wi-Fi/Bluetooth",
          "risk": "Android escanea continuamente las redes Wi-Fi y Bluetooth para mejorar la ubicación, incluso cuando no las usas.",
          "severity": "important",
          "steps": [
            {
              "label": "Abrir los ajustes de ubicación",
              "intent": { "action": "android.settings.LOCATION_SOURCE_SETTINGS" },
              "fallbackPath": "Ajustes > Ubicación > Servicios de ubicación"
            },
            { "label": "Desactivar « Búsqueda de Wi-Fi » y « Búsqueda de Bluetooth »" }
          ]
        }
      ]
    },
    {
      "categoryId": "assistants",
      "label": "Asistentes de voz",
      "description": "Evitar la escucha permanente del micrófono.",
      "checks": [
        {
          "checkId": "google-assistant-hotword",
          "title": "Desactivar « Hey Google »",
          "risk": "Con la palabra de activación habilitada, el micrófono está siempre escuchando.",
          "severity": "important",
          "steps": [
            { "label": "Abrir la aplicación Google, luego Ajustes > Asistente de Google" },
            { "label": "Ir a « Hey Google y Voice Match » y desactivar" }
          ]
        }
      ]
    },
    {
      "categoryId": "motorola-services",
      "label": "Servicios Motorola",
      "description": "Limitar la recopilación de datos por parte de Motorola y Lenovo.",
      "checks": [
        {
          "checkId": "motorola-services-checkin",
          "title": "Desactivar el envío de datos a Motorola",
          "risk": "Motorola y su empresa matriz Lenovo recopilan información de uso del dispositivo a través de las opciones « Enhanced Device Support » y « Help Improve » activadas por defecto.",
          "whyItMatters": "Estas opciones envían regularmente informes de uso a los servidores de Motorola/Lenovo, incluso cuando no usas ninguna aplicación Motorola.",
          "severity": "critical",
          "steps": [
            {
              "label": "Abrir los ajustes del sistema",
              "intent": { "action": "android.settings.SETTINGS" },
              "fallbackPath": "Ajustes > Sistema > Enhanced Device Support"
            },
            { "label": "Desactivar « Enhanced Device Support »" },
            { "label": "Buscar « Help Improve » en los ajustes y desactivar todas las opciones que encuentres" }
          ]
        },
        {
          "checkId": "motorola-privacy-preferences",
          "title": "Revisar las preferencias de Moto Secure",
          "risk": "La aplicación Moto Secure agrupa varios ajustes de privacidad de Motorola (panel, permisos, red) y algunos pueden compartir datos con Motorola.",
          "severity": "important",
          "steps": [
            {
              "label": "Abrir Seguridad y privacidad",
              "intent": { "action": "android.settings.PRIVACY_SETTINGS" },
              "fallbackPath": "Ajustes > Seguridad y privacidad > Más seguridad y privacidad"
            },
            { "label": "Recorrer las secciones de Moto Secure y desactivar cualquier intercambio de datos no deseado" }
          ]
        }
      ]
    },
    {
      "categoryId": "permissions",
      "label": "Permisos de aplicaciones",
      "description": "Comprobar que ninguna aplicación tenga acceso injustificado a tu micrófono, cámara o ubicación.",
      "checks": [
        {
          "checkId": "permissions-audit",
          "title": "Auditar los permisos sensibles",
          "risk": "Algunas aplicaciones mantienen el acceso al micrófono, cámara o ubicación en segundo plano mucho más de lo necesario.",
          "severity": "critical",
          "steps": [
            {
              "label": "Abrir el gestor de permisos",
              "intent": { "action": "android.settings.PRIVACY_SETTINGS" },
              "fallbackPath": "Ajustes > Seguridad y privacidad > Privacidad > Gestor de permisos"
            },
            { "label": "Revisar cada categoría (Micrófono, Cámara, Ubicación) y restringir las aplicaciones sospechosas" }
          ]
        }
      ]
    }
  ]
}
